{
  "id": "display-copy",
  "revision": 2,
  "title": "Display copy",
  "description": "Short role-specific composition with intact source and bounded exceptions.",
  "rule_ids": [
    "CONTENT-001",
    "CONTENT-002",
    "CONTENT-003",
    "CONTENT-004",
    "CONTENT-005",
    "JA-TYPE-001",
    "JA-TYPE-002",
    "JA-TYPE-003",
    "JA-TYPE-004",
    "JA-TYPE-005",
    "JA-TYPE-006",
    "JA-TYPE-007",
    "JA-TYPE-008",
    "JA-TYPE-009",
    "JA-TYPE-010",
    "JA-TYPE-011",
    "DESIGN-001",
    "DESIGN-002",
    "DESIGN-003",
    "DESIGN-004",
    "DESIGN-005",
    "DESIGN-006",
    "EVIDENCE-001",
    "EVIDENCE-002",
    "EVIDENCE-003",
    "EVIDENCE-004",
    "EVIDENCE-005"
  ],
  "guidance": [
    "Choose display treatment by purpose and actual font; there is no universal tightening recipe.",
    "Review rendered line edges separately from semantic word grouping.",
    "An approval must resolve to current authorized bounds; waived remains distinct from passed.",
    "No detector or rendering pass is implied by selecting a rule.",
    "Select design rules by actual purpose, brand constraints and readable access; a motif alone is not a verdict.",
    "Require a pre-production contract and current attributable authorization; verify bounded exception records separately.",
    "Strict comparison of repeated structures is an explicit review policy; do not infer a universal ban on three cards or gradients."
  ]
}
