{
  "id": "report-document",
  "revision": 1,
  "title": "Report document",
  "description": "Source-faithful tables, notes, pagination and native-output limitations.",
  "rule_ids": [
    "CONTENT-001",
    "CONTENT-002",
    "CONTENT-003",
    "CONTENT-004",
    "CONTENT-005",
    "JA-TYPE-001",
    "JA-TYPE-002",
    "JA-TYPE-003",
    "JA-TYPE-004",
    "JA-TYPE-005",
    "JA-TYPE-006",
    "JA-TYPE-007",
    "JA-TYPE-008",
    "JA-TYPE-009",
    "JA-TYPE-010",
    "DOC-001",
    "DOC-002",
    "DOC-004",
    "EVIDENCE-001",
    "EVIDENCE-002",
    "EVIDENCE-003",
    "EVIDENCE-004",
    "EVIDENCE-005"
  ],
  "guidance": [
    "Inspect all relevant pages and source-data relationships.",
    "Review measure and annotation collisions with actual fonts.",
    "Record native rendering and editability as tested or untested independently.",
    "This profile selects the available non-design catalog contribution; applicable design rules must be resolved from the complete release catalog before design clearance.",
    "No detector or rendering pass is implied by selecting a rule."
  ]
}
